{
  "workflow_id": "contract-poc",
  "version": 1,
  "nodes": [
    {
      "node_id": "parse",
      "capability_id": "document.parser",
      "capability_version": "1.0.0",
      "config": {}
    },
    {
      "node_id": "extract",
      "capability_id": "document.extractor",
      "capability_version": "1.0.0",
      "config": {
        "schema_profile": "contract-v1"
      }
    },
    {
      "node_id": "validate",
      "capability_id": "document.rule_validator",
      "capability_version": "1.0.0",
      "config": {
        "rule_pack": "contract-v1"
      }
    }
  ],
  "edges": [
    {
      "from": "parse",
      "to": "extract"
    },
    {
      "from": "extract",
      "to": "validate"
    }
  ],
  "requires_human_approval": true
}
